{
  "schema_version": "role-topology-study-plan/1.0",
  "suite": "role_topology_utility",
  "plan_version": "0.1.0",
  "issue": 582,
  "phase_status": "design_and_synthetic_seed_only",
  "content_class": "repository-owned synthetic manuscripts, evidence summaries, and revision briefs",
  "authority_design_ref": "dev/design/2026-08-13-582-role-topology-utility-design.md",
  "invocation_adapter_ref": "evals/heldout/role_topology_utility/invocation_adapter.md",
  "task_classes": [
    {
      "task_class_id": "decomposable_reviewer_evidence_review",
      "independence_key": "reviewer-evidence-v1",
      "unit_of_analysis": "atomic defect or evidence-alignment finding",
      "evaluator_id": "reviewer-evidence-rubric-v1",
      "outcome_vocabulary": [
        "detected",
        "partial",
        "missed",
        "false_blocker",
        "duplicate"
      ],
      "forbidden_outcomes": [],
      "arms": [
        {
          "arm_id": "review_inline_1",
          "role_count": 1,
          "final_output_seat": "review-solo",
          "topology": "single_inline",
          "roles": [
            {
              "seat_id": "review-solo",
              "role_id": "inline_evidence_reviewer",
              "role_ref": "evals/heldout/role_topology_utility/inline_reviewer.md",
              "stage": 0,
              "depends_on": [],
              "output_kind": "final_outcome",
              "study_output_contract": "Return atomic anchored findings and one deduplicated final synthesis; do not emit editorial-decision labels."
            }
          ]
        },
        {
          "arm_id": "review_panel_2",
          "role_count": 2,
          "final_output_seat": "review-synthesis",
          "topology": "one_specialist_then_synthesis",
          "roles": [
            {
              "seat_id": "review-methodology",
              "role_id": "methodology_reviewer",
              "role_ref": "academic-paper-reviewer/agents/methodology_reviewer_agent.md",
              "stage": 0,
              "depends_on": [],
              "output_kind": "intermediate_artifact",
              "study_output_contract": "Return only role-scoped atomic anchored findings; do not synthesize other seats or emit editorial-decision labels."
            },
            {
              "seat_id": "review-synthesis",
              "role_id": "editorial_synthesizer",
              "role_ref": "academic-paper-reviewer/agents/editorial_synthesizer_agent.md",
              "stage": 1,
              "depends_on": [
                "review-methodology"
              ],
              "output_kind": "final_outcome",
              "study_output_contract": "Using only retained reviewer outputs, return one deduplicated synthesis of atomic anchored findings; do not emit editorial-decision labels."
            }
          ]
        },
        {
          "arm_id": "review_panel_5",
          "role_count": 5,
          "final_output_seat": "review-synthesis",
          "topology": "four_parallel_specialists_then_synthesis",
          "roles": [
            {
              "seat_id": "review-journal-fit",
              "role_id": "journal_fit_reviewer",
              "role_ref": "academic-paper-reviewer/agents/eic_agent.md",
              "stage": 0,
              "depends_on": [],
              "output_kind": "intermediate_artifact",
              "study_output_contract": "Return only role-scoped atomic anchored findings; do not synthesize other seats or emit editorial-decision labels."
            },
            {
              "seat_id": "review-methodology",
              "role_id": "methodology_reviewer",
              "role_ref": "academic-paper-reviewer/agents/methodology_reviewer_agent.md",
              "stage": 0,
              "depends_on": [],
              "output_kind": "intermediate_artifact",
              "study_output_contract": "Return only role-scoped atomic anchored findings; do not synthesize other seats or emit editorial-decision labels."
            },
            {
              "seat_id": "review-domain",
              "role_id": "domain_reviewer",
              "role_ref": "academic-paper-reviewer/agents/domain_reviewer_agent.md",
              "stage": 0,
              "depends_on": [],
              "output_kind": "intermediate_artifact",
              "study_output_contract": "Return only role-scoped atomic anchored findings; do not synthesize other seats or emit editorial-decision labels."
            },
            {
              "seat_id": "review-devils-advocate",
              "role_id": "devils_advocate_reviewer",
              "role_ref": "academic-paper-reviewer/agents/devils_advocate_reviewer_agent.md",
              "stage": 0,
              "depends_on": [],
              "output_kind": "intermediate_artifact",
              "study_output_contract": "Return only role-scoped atomic anchored findings; do not synthesize other seats or emit editorial-decision labels."
            },
            {
              "seat_id": "review-synthesis",
              "role_id": "editorial_synthesizer",
              "role_ref": "academic-paper-reviewer/agents/editorial_synthesizer_agent.md",
              "stage": 1,
              "depends_on": [
                "review-journal-fit",
                "review-methodology",
                "review-domain",
                "review-devils-advocate"
              ],
              "output_kind": "final_outcome",
              "study_output_contract": "Using only retained reviewer outputs, return one deduplicated synthesis of atomic anchored findings; do not emit editorial-decision labels."
            }
          ]
        },
        {
          "arm_id": "review_panel_7",
          "role_count": 7,
          "final_output_seat": "review-synthesis",
          "topology": "field_configuration_five_parallel_reviewers_then_synthesis",
          "roles": [
            {
              "seat_id": "review-field-analysis",
              "role_id": "field_analyst",
              "role_ref": "academic-paper-reviewer/agents/field_analyst_agent.md",
              "stage": 0,
              "depends_on": [],
              "output_kind": "intermediate_artifact",
              "study_output_contract": "Return only reviewer configuration: scoped questions and evidence-to-reviewer assignments; do not make findings, suggest answers, synthesize, or emit editorial-decision labels."
            },
            {
              "seat_id": "review-journal-fit",
              "role_id": "journal_fit_reviewer",
              "role_ref": "academic-paper-reviewer/agents/eic_agent.md",
              "stage": 1,
              "depends_on": [
                "review-field-analysis"
              ],
              "output_kind": "intermediate_artifact",
              "study_output_contract": "Return only role-scoped atomic anchored findings; do not synthesize other seats or emit editorial-decision labels."
            },
            {
              "seat_id": "review-methodology",
              "role_id": "methodology_reviewer",
              "role_ref": "academic-paper-reviewer/agents/methodology_reviewer_agent.md",
              "stage": 1,
              "depends_on": [
                "review-field-analysis"
              ],
              "output_kind": "intermediate_artifact",
              "study_output_contract": "Return only role-scoped atomic anchored findings; do not synthesize other seats or emit editorial-decision labels."
            },
            {
              "seat_id": "review-domain",
              "role_id": "domain_reviewer",
              "role_ref": "academic-paper-reviewer/agents/domain_reviewer_agent.md",
              "stage": 1,
              "depends_on": [
                "review-field-analysis"
              ],
              "output_kind": "intermediate_artifact",
              "study_output_contract": "Return only role-scoped atomic anchored findings; do not synthesize other seats or emit editorial-decision labels."
            },
            {
              "seat_id": "review-perspective",
              "role_id": "perspective_reviewer",
              "role_ref": "academic-paper-reviewer/agents/perspective_reviewer_agent.md",
              "stage": 1,
              "depends_on": [
                "review-field-analysis"
              ],
              "output_kind": "intermediate_artifact",
              "study_output_contract": "Return only role-scoped atomic anchored findings; do not synthesize other seats or emit editorial-decision labels."
            },
            {
              "seat_id": "review-devils-advocate",
              "role_id": "devils_advocate_reviewer",
              "role_ref": "academic-paper-reviewer/agents/devils_advocate_reviewer_agent.md",
              "stage": 1,
              "depends_on": [
                "review-field-analysis"
              ],
              "output_kind": "intermediate_artifact",
              "study_output_contract": "Return only role-scoped atomic anchored findings; do not synthesize other seats or emit editorial-decision labels."
            },
            {
              "seat_id": "review-synthesis",
              "role_id": "editorial_synthesizer",
              "role_ref": "academic-paper-reviewer/agents/editorial_synthesizer_agent.md",
              "stage": 2,
              "depends_on": [
                "review-journal-fit",
                "review-methodology",
                "review-domain",
                "review-perspective",
                "review-devils-advocate"
              ],
              "output_kind": "final_outcome",
              "study_output_contract": "Using only retained reviewer outputs, return one deduplicated synthesis of atomic anchored findings; do not emit editorial-decision labels."
            }
          ]
        }
      ]
    },
    {
      "task_class_id": "sequential_writing_revision",
      "independence_key": "writing-revision-v1",